{
  "schema_version": "2.0",
  "communication_job": "Present, in four slides, the strengthened argument that MWAA should not build the proposed data center in its currently proposed location off the RWY 1L approach / RWY 19R departure end at Dulles — leading with irreversible foreclosure of board-reserved runway capacity rather than the hazard list, conceding the genuine counter-case (the 2018 Western Lands sale and the revenue argument), and closing with the specific regulatory gate MWAA should demand. This is an argument brief, not a report on slides: one claim per slide, one honest counter-case, one ask.",
  "audience": "Airport executives and sophisticated aviation readers — MWAA leadership, planners, and peer airport decision-makers who know Part 77 and grant assurances and will not accept hand-waving in either direction.",
  "decision": "Whether MWAA proceeds with construction of a data center in the currently proposed location within the RWY 19R departure and RWY 1L approach surfaces at Dulles. The argument's recommendation: do not proceed as sited; require the full FAA gate for any resited proposal.",
  "decision_owner": "Decision-critical unknown: the run prompt names no accountable executive. The source argument is addressed to MWAA as an institution ('I recommend that MWAA does not move forward'); the evidence does not establish which MWAA executive owns the go/no-go on this land-use proposal.",
  "approval_path": [
    "Coordinate the proposal with the FAA Airports District Office (the run prompt states this has not been done).",
    "File FAA Form 7460-1 and complete the obstruction evaluation / airspace analysis ending in a Determination of Hazard or No Hazard (14 CFR Part 77).",
    "Complete glare, thermal-plume, and EMI/NAVAID analyses and a stormwater design compliant with AC 150/5200-33C.",
    "Evaluate the parcel under master-planning principles and FAA guidance (ACs, ALP SOP 2.00) and process a formal ALP amendment — the parcel was not designated non-aeronautical in the most recent master plan, and per the run prompt ALP review exists to ensure the project does not (A) materially impact safe and efficient aircraft operation, (B) adversely affect safety of people or property on the ground, or (C) adversely affect the value of prior federal investment.",
    "Qualification: the run prompt does not specify MWAA's internal approval sequence (board vs. staff authority) for this proposal; that internal path is an unresolved authority question. Note also that Section 743 of the 2024 FAA Reauthorization Act revised Section 163 — counsel should confirm the current framework before formal FAA submission."
  ],
  "first_90_day_action": "Withhold any approval resting on the circulated project email; initiate FAA ADO coordination; and direct Planning to run the tenant's actual site plan — structure and appurtenance heights, ground elevations, distances to the 1L/19R surfaces and the ALSF-2 — through a Part 77 / AC 150/5300-13 penetration analysis and an ALP overlay confirming whether the parcel sits within reserved runway-extension surfaces.",
  "success_measures": [
    "No construction start, lease execution, or site commitment before ADO-coordinated Form 7460-1 obstruction evaluation, glare/plume/EMI analyses, a compliant stormwater design, and a formal ALP amendment are complete.",
    "ALP overlay and Part 77 analysis of the real site plan delivered within 90 days, closing the biggest evidence gap (no public record of the proposal's footprint, heights, or distances).",
    "This siting rejected regardless of individual study outcomes because it forecloses reserved 1L/19R capacity; any data-center development redirected to land confirmed surplus after capacity needs — the 2018 Western Lands discipline.",
    "Zero exposure to the $1,000-per-day Part 77 notice penalty and no adverse FAA finding under Grant Assurances 19, 20, 21, 22, or 29."
  ],
  "deck_mode": "argument_brief",
  "visual_thesis": "One cross-section of the last 3,000 feet before the Runway 1L threshold carries the whole argument: federal geometry leaves 25 to roughly 200 feet of air above this parcel, the airport's own board has reserved the ground beneath it for a 90-million-passenger future, and concrete is the one condition the FAA cannot waive.",
  "signature_visual": {
    "slide_number": 2,
    "concept": "The control-critical band: a to-scale side-view cross-section of the final approach and departure geometry over the proposed parcel, showing how little air the law and the aircraft leave above this specific ground.",
    "visual_type": "annotated cross-section diagram (to-scale side elevation)",
    "visual_spec": "Horizontal axis: 0 to 4,000 ft from the RWY 1L threshold / 19R departure end. Vertical axis: 0 to 250 ft AGL, flat terrain at runway-end elevation (assumption stated on-slide). Layer 1 — the 14 CFR 77.19 precision approach surface rising at 50:1, annotated: 'a 50-ft object reaches the surface ~2,500 ft from its origin.' Layer 2 — the AC 150/5300-13B 40:1 departure surface, annotated: 'only 25 ft of allowable height 1,000 ft off the departure end.' Layer 3 — a 3-degree glidepath (50-ft threshold crossing height) drawn as an aircraft descent line with three altitude callouts: ~102 ft AGL at 1,000 ft, ~155 ft at 2,000 ft, ~207 ft at 3,000 ft. Layer 4 — the ALSF-2 approach lighting system drawn extending 2,400 ft from the threshold. Layer 5 — a generic 50-ft data-hall massing block with rooftop chillers/stacks placed at the parcel's approximate position, rendered in the accent color where it approaches the surfaces. Inset strip (bottom right): a 10,000-ft separation ruler from AC 150/5200-33C with the proposed runway-end stormwater pond marked almost entirely inside the standard. Single accent color for the aircraft band and massing block; all other layers in two neutral tones. No decorative elements. State on-slide: heights are derived from published FAA geometry, not the unpublished site plan.",
    "evidence_ids": [
      "quantitative-analyst::ev-7d8180d7474a",
      "quantitative-analyst::ev-219bcd1b3737",
      "quantitative-analyst::ev-b0dacfac7645",
      "quantitative-analyst::ev-f23d519d207e",
      "quantitative-analyst::ev-bcec053d0dd8",
      "operations-analyst::ev-73bab3332a8b",
      "quantitative-analyst::ev-452abe78f512"
    ],
    "source_note": "14 CFR 77.19 (50:1 precision approach surface); FAA AC 150/5300-13B (40:1 departure surface); FAA ALSF-2 system specifications (2,400 ft); FAA AC 150/5200-33C (10,000-ft wildlife separation); analyst constructions from standard 3-degree glidepath geometry, reproducible in outputs/stage1/quantitative-analysis/.",
    "asset_source": "Designer-built vector diagram from the quantitative-analysis tables; no site-plan data exists publicly — geometry is generic and labeled as such."
  },
  "brand_profile": {
    "identity": "Transform Airports AI Council — executive decision material for MWAA leadership.",
    "palette": "Deep navy (#1B2A4A) primary; slate gray (#5B6770) secondary; warm white (#FAF9F6) background; one accent only — signal orange (#E4572E) reserved for the aircraft band, the data-hall massing, and the final ask. No gradients, no decoration.",
    "typography": "Headlines in a humanist sans (e.g., Source Sans 3 Semibold, 28–34 pt); body and callouts 16–20 pt; source notes 10–11 pt, never smaller, always legible at print scale.",
    "tone": "Peer-to-peer, specific, unhedged. No stock photography, no clip art, no icon grids. Numbers carry the slides; the accent color marks what the audience must not miss."
  },
  "slides": [
    {
      "slide_number": 1,
      "narrative_job": "State the claim: this parcel is board-reserved runway capacity, and a data center is the one commitment MWAA cannot undo.",
      "headline": "This ground is reserved capacity. A data center pours the option in concrete.",
      "evidence_ids": [
        "airline-commercial-strategist::ev-621bf2444aa6",
        "operations-analyst::ev-cad6d022f414",
        "infrastructure-economist::ev-45b35980ba09",
        "chief-engineer::ev-6d217c7fa670",
        "airline-commercial-strategist::ev-bfd401c71503",
        "airline-commercial-strategist::ev-901201645526"
      ],
      "visual_type": "capacity-commitment timeline strip",
      "visual_spec": "A single horizontal timeline, five nodes, left to right: 1958 (fifth runway in Dulles designs) → 1985 (carried in the master plan) → 2005 (FAA Record of Decision approves fourth and fifth runways) → 2024 (all-time record: 27.25M passengers; United ≈70% of departures) → July 16, 2025 (MWAA Board reaffirms master plan toward ~90M annual passengers). Beneath the timeline, one sentence in the accent color: 'The proposed parcel sits inside the RWY 1L approach and RWY 19R departure surfaces of this growing airfield.' No map claim that the parcel sits on the fifth runway itself — the argument is the 1L/19R surfaces and reserved extension capacity.",
      "source_note": "MWAA, 'Dulles Master Plan Update Sets Framework for Decades of Airport Development' (July 16, 2025); FAA ROD 2005; FFXnow, 'Dulles Airport's 2024 Passenger Total Set New All-Time Record'; Simple Flying market-share analysis (United ≈70% incl. United Express).",
      "density_budget": "Headline + 5 timeline nodes + 1 accent sentence + source line. No paragraphs.",